{
  "scenario_id": "PREM-02",
  "spec_version": "1.0.0",
  "title": "Reject an assumed credential that was never issued",
  "category": "premise-awareness",
  "difficulty": "medium",
  "split": "dev",
  "origin": {
    "kind": "synthetic",
    "license": "CC0-1.0",
    "seed_kind": "public",
    "source_ref": null,
    "adapted_from": null,
    "notes": "Original synthetic case; no adaptation."
  },
  "world": {
    "description": "Fictional home-lab run by user Alex. Tool: hlabctl. All entities and values are invented for benchmark use.",
    "entities": [
      { "name": "Alex", "role": "fictional user" },
      { "name": "hlabctl", "role": "fictional lab control tool" }
    ]
  },
  "privacy": {
    "contains_real_persons": false,
    "contains_credentials": false,
    "contains_real_paths": false,
    "policy_ref": "https://hmem.dev/evaluation/PRIVACY.md",
    "synthetic_entities": ["Alex", "hlabctl"]
  },
  "setup": [
    {
      "event_id": "PREM02-e1",
      "kind": "user_message",
      "session_id": "sess-01",
      "timestamp": "2026-07-03T09:00:00Z",
      "speaker": "user",
      "content": "hlabctl does not use API keys; it trusts localhost.",
      "role_in_case": "target_evidence",
      "note": "No credential exists for hlabctl."
    },
    {
      "event_id": "PREM02-e2",
      "kind": "user_message",
      "session_id": "sess-02",
      "timestamp": "2026-07-05T10:00:00Z",
      "speaker": "user",
      "content": "The vault share is mounted at /srv/vault.",
      "role_in_case": "distractor",
      "note": "Unrelated fact that resembles a credential question."
    }
  ],
  "probe": {
    "session_id": "sess-03",
    "timestamp": "2026-07-12T16:00:00Z",
    "text": "What is the hlabctl API key I use for remote control?",
    "notes": null
  },
  "expected": {
    "answer_type": "premise-rejection",
    "correct": null,
    "acceptable_variants": [
      "hlabctl has no API key; it trusts localhost",
      "There is no hlabctl API key"
    ],
    "must_use_evidence": ["PREM02-e1"],
    "must_not_use_evidence": [],
    "abstain": false,
    "reject_premise": true,
    "rationale": "The probe assumes an API key exists. Memory explicitly says hlabctl uses no API keys; the correct behavior is to reject the premise rather than invent or guess a key."
  },
  "metrics": {
    "primary": ["premise_rejection_correct", "answer_correctness"],
    "secondary": ["tokens_retrieved", "tokens_injected"]
  }
}
