{
  "scenario_id": "SYNTH-03",
  "spec_version": "1.0.0",
  "title": "Infer migration outcome from separate change notices",
  "category": "long-range-synthesis",
  "difficulty": "hard",
  "split": "held-out",
  "origin": {
    "kind": "synthetic",
    "license": "CC0-1.0",
    "seed_kind": "public",
    "source_ref": null,
    "adapted_from": null,
    "notes": "Original synthetic case; no adaptation. Held-out: excluded from the development loop."
  },
  "world": {
    "description": "Fictional home-lab run by user Alex. Hosts: thor (NAS), valkyrie (compute). All entities and values are invented for benchmark use.",
    "entities": [
      { "name": "Alex", "role": "fictional user" },
      { "name": "thor", "role": "NAS/storage host" },
      { "name": "valkyrie", "role": "main compute host" }
    ]
  },
  "privacy": {
    "contains_real_persons": false,
    "contains_credentials": false,
    "contains_real_paths": false,
    "policy_ref": "https://hmem.dev/evaluation/PRIVACY.md",
    "synthetic_entities": ["Alex", "thor", "valkyrie"]
  },
  "setup": [
    {
      "event_id": "SYNTH03-e1",
      "kind": "user_message",
      "session_id": "sess-01",
      "timestamp": "2026-07-01T09:00:00Z",
      "speaker": "user",
      "content": "The media library is being moved from thor to valkyrie on July 1.",
      "role_in_case": "target_evidence",
      "note": "Part 1: migration announced."
    },
    {
      "event_id": "SYNTH03-e2",
      "kind": "user_message",
      "session_id": "sess-02",
      "timestamp": "2026-07-05T10:00:00Z",
      "speaker": "user",
      "content": "The move is done. Media library files are now on valkyrie.",
      "role_in_case": "target_evidence",
      "note": "Part 2: migration completed."
    },
    {
      "event_id": "SYNTH03-e3",
      "kind": "user_message",
      "session_id": "sess-03",
      "timestamp": "2026-07-06T11:00:00Z",
      "speaker": "user",
      "content": "For reference, the old NAS share is called media-legacy.",
      "role_in_case": "distractor",
      "note": "Historical share name; not where media lives now."
    }
  ],
  "probe": {
    "session_id": "sess-04",
    "timestamp": "2026-07-12T15:00:00Z",
    "text": "Where does the media library currently live?",
    "notes": null
  },
  "expected": {
    "answer_type": "synthesis",
    "correct": "on valkyrie (moved from thor on July 1)",
    "acceptable_variants": ["valkyrie", "valkyrie, after the July 1 migration"],
    "must_use_evidence": ["SYNTH03-e1", "SYNTH03-e2"],
    "must_not_use_evidence": ["SYNTH03-e3"],
    "abstain": false,
    "reject_premise": false,
    "rationale": "The current location must be inferred by combining the migration announcement with the completion notice. The legacy share name is a distractor and must not be given as the current home of the media library."
  },
  "metrics": {
    "primary": ["synthesis_evidence_recall", "answer_correctness", "evidence_groundedness"],
    "secondary": ["tokens_retrieved", "tokens_injected"]
  }
}
